{
  "artifact": {
    "approval_requirements": [],
    "budget_class": "medium",
    "created_at": "2026-04-22T15:54:53Z",
    "execution_lane": "guarded",
    "id": "eval-spec-anthropic-2026-04-20-april-20-2026-25307862",
    "next_stage": "build",
    "owner_agent": "Eval Engineer",
    "policy_decision_id": "policy-anthropic-2026-04-20-april-20-2026-25307862",
    "risk_tier": "medium",
    "rollback_class": "reversible_deploy",
    "source_stage": "eval_generation",
    "status": "ready",
    "updated_at": "2026-04-22T15:54:53Z",
    "version": 1
  },
  "target_id": "ticket-bundle-spec-anthropic-2026-04-20-april-20-2026-25307862",
  "target_type": "ticket_bundle",
  "tiers": [
    {
      "checks": [
        {
          "id": "check-pr-smoke-lint-ticket-bundle-spec-anthropic-2026-04-20-apri",
          "kind": "lint",
          "name": "Lint",
          "pass_condition": "lint exits 0",
          "required": true,
          "timeout_minutes": 5
        },
        {
          "id": "check-pr-smoke-typecheck-ticket-bundle-spec-anthropic-2026-04-20",
          "kind": "typecheck",
          "name": "Typecheck",
          "pass_condition": "type checks exit 0",
          "required": true,
          "timeout_minutes": 10
        },
        {
          "id": "check-pr-smoke-unit-ticket-bundle-spec-anthropic-2026-04-20-apri",
          "kind": "unit",
          "name": "Unit tests",
          "pass_condition": "ticket-scoped unit tests pass",
          "required": true,
          "timeout_minutes": 15
        },
        {
          "id": "check-pr-smoke-contract-ticket-bundle-spec-anthropic-2026-04-20",
          "kind": "contract",
          "name": "Contract validation",
          "pass_condition": "contract validation exits 0",
          "required": true,
          "timeout_minutes": 10
        },
        {
          "baseline_ref": "baseline-pr-smoke-focused-llm-golden-set-ticket-bundle-spec-anthropic-20",
          "id": "check-pr-smoke-focused-llm-golden-set-ticket-bundle-spec-anthrop",
          "kind": "llm_quality",
          "name": "Focused golden-set quality check",
          "pass_condition": "quality score delta remains at or below 0.25 when the optional suite is run",
          "required": false,
          "timeout_minutes": 15,
          "waivable": true
        }
      ],
      "name": "pr_smoke"
    },
    {
      "checks": [
        {
          "id": "check-pre-merge-integration-ticket-bundle-spec-anthropic-2026-04",
          "kind": "integration",
          "name": "Integration tests",
          "pass_condition": "ticket-scoped integration checks pass",
          "required": true,
          "timeout_minutes": 30
        },
        {
          "id": "check-pre-merge-migration-safety-ticket-bundle-spec-anthropic-20",
          "kind": "migration_safety",
          "name": "Migration safety checks",
          "pass_condition": "rollback and migration safety checks pass",
          "required": true,
          "timeout_minutes": 20
        },
        {
          "baseline_ref": "baseline-pre-merge-targeted-regression-ticket-bundle-spec-anthropic-2026",
          "id": "check-pre-merge-targeted-regression-ticket-bundle-spec-anthropic",
          "kind": "llm_quality",
          "name": "Targeted regression suite",
          "pass_condition": "quality score delta remains at or below 0.15",
          "required": true,
          "timeout_minutes": 20
        },
        {
          "baseline_ref": "baseline-pre-merge-latency-benchmark-ticket-bundle-spec-anthropic-2026-0",
          "id": "check-pre-merge-latency-benchmark-ticket-bundle-spec-anthropic-2",
          "kind": "latency",
          "name": "Latency benchmark",
          "pass_condition": "latency regression remains under 15 percent",
          "required": true,
          "timeout_minutes": 15
        },
        {
          "baseline_ref": "baseline-pre-merge-cost-benchmark-ticket-bundle-spec-anthropic-2026-04-2",
          "id": "check-pre-merge-cost-benchmark-ticket-bundle-spec-anthropic-2026",
          "kind": "cost",
          "name": "Cost benchmark",
          "pass_condition": "cost regression remains under 10 percent",
          "required": true,
          "timeout_minutes": 15
        },
        {
          "baseline_ref": "baseline-pre-merge-broader-llm-regression-ticket-bundle-spec-anthropic-2",
          "id": "check-pre-merge-broader-llm-regression-ticket-bundle-spec-anthro",
          "kind": "llm_quality",
          "name": "Broader LLM regression suite",
          "pass_condition": "quality score delta remains at or below 0.15 when the optional suite is run",
          "required": false,
          "timeout_minutes": 30,
          "waivable": true
        }
      ],
      "name": "pre_merge"
    },
    {
      "checks": [
        {
          "id": "check-nightly-adversarial-prompt-suite-ticket-bundle-spec-anthro",
          "kind": "adversarial",
          "name": "Adversarial prompt suite",
          "pass_condition": "adversarial failure count remains at 0",
          "required": true,
          "timeout_minutes": 40
        },
        {
          "id": "check-nightly-long-running-integration-ticket-bundle-spec-anthro",
          "kind": "integration",
          "name": "Long-running integration suite",
          "pass_condition": "ticket-scoped integration checks pass",
          "required": true,
          "timeout_minutes": 60
        },
        {
          "baseline_ref": "baseline-nightly-full-golden-dataset-ticket-bundle-spec-anthropic-2026-0",
          "id": "check-nightly-full-golden-dataset-ticket-bundle-spec-anthropic-2",
          "kind": "llm_quality",
          "name": "Full golden-dataset quality suite",
          "pass_condition": "quality score delta remains at or below 0.1",
          "required": true,
          "timeout_minutes": 45
        },
        {
          "baseline_ref": "baseline-nightly-cross-model-comparison-ticket-bundle-spec-anthropic-202",
          "id": "check-nightly-cross-model-comparison-ticket-bundle-spec-anthropi",
          "kind": "llm_quality",
          "name": "Cross-model comparison suite",
          "pass_condition": "quality score delta remains at or below 0.1 when the optional suite is run",
          "required": false,
          "timeout_minutes": 45,
          "waivable": true
        },
        {
          "id": "check-nightly-synthetic-shadow-replay-ticket-bundle-spec-anthrop",
          "kind": "integration",
          "name": "Synthetic shadow replay",
          "pass_condition": "ticket-scoped integration checks pass",
          "required": false,
          "timeout_minutes": 60,
          "waivable": true
        }
      ],
      "name": "nightly"
    },
    {
      "checks": [
        {
          "id": "check-post-deploy-canary-error-rate-ticket-bundle-spec-anthropic",
          "kind": "integration",
          "name": "Canary error-rate check",
          "pass_condition": "canary traffic shows 0 critical failures and stays within the configured error budget",
          "required": true,
          "timeout_minutes": 20
        },
        {
          "baseline_ref": "baseline-post-deploy-canary-latency-ticket-bundle-spec-anthropic-2026-04",
          "id": "check-post-deploy-canary-latency-ticket-bundle-spec-anthropic-20",
          "kind": "latency",
          "name": "Canary latency check",
          "pass_condition": "latency regression remains under 10 percent",
          "required": true,
          "timeout_minutes": 20
        },
        {
          "baseline_ref": "baseline-post-deploy-canary-cost-ticket-bundle-spec-anthropic-2026-04-20",
          "id": "check-post-deploy-canary-cost-ticket-bundle-spec-anthropic-2026",
          "kind": "cost",
          "name": "Canary cost check",
          "pass_condition": "cost regression remains under 10 percent",
          "required": true,
          "timeout_minutes": 20
        },
        {
          "id": "check-post-deploy-rollback-probe-ticket-bundle-spec-anthropic-20",
          "kind": "migration_safety",
          "name": "Rollback probe",
          "pass_condition": "rollback and migration safety checks pass",
          "required": true,
          "timeout_minutes": 15
        },
        {
          "baseline_ref": "baseline-post-deploy-business-kpi-proxy-ticket-bundle-spec-anthropic-202",
          "id": "check-post-deploy-business-kpi-proxy-ticket-bundle-spec-anthropi",
          "kind": "llm_quality",
          "name": "Business KPI proxy check",
          "pass_condition": "quality score delta remains at or below 0.1 when the optional suite is run",
          "required": false,
          "timeout_minutes": 30,
          "waivable": true
        },
        {
          "baseline_ref": "baseline-post-deploy-live-quality-sampling-ticket-bundle-spec-anthropic",
          "id": "check-post-deploy-live-quality-sampling-ticket-bundle-spec-anthr",
          "kind": "llm_quality",
          "name": "Live quality sampling",
          "pass_condition": "quality score delta remains at or below 0.1 when the optional suite is run",
          "required": false,
          "timeout_minutes": 30,
          "waivable": true
        }
      ],
      "name": "post_deploy"
    }
  ]
}
