{
  "artifact": {
    "id": "eval-fast-001",
    "version": 1,
    "source_stage": "eval_generation",
    "next_stage": "build",
    "status": "ready",
    "risk_tier": "low",
    "execution_lane": "fast",
    "owner_agent": "Eval Engineer",
    "policy_decision_id": "policy-fast-001",
    "budget_class": "small",
    "rollback_class": "immediate_flag_disable",
    "approval_requirements": [],
    "created_at": "2026-04-22T13:05:00Z",
    "updated_at": "2026-04-22T13:05:00Z"
  },
  "target_type": "ticket_bundle",
  "target_id": "ticket-bundle-fast-001",
  "tiers": [
    {
      "name": "pr_smoke",
      "checks": [
        {
          "id": "check-fast-lint",
          "name": "Lint",
          "kind": "lint",
          "required": true,
          "timeout_minutes": 5,
          "pass_condition": "lint exits 0"
        },
        {
          "id": "check-fast-unit",
          "name": "Unit tests",
          "kind": "unit",
          "required": true,
          "timeout_minutes": 10,
          "pass_condition": "all focused unit tests pass"
        }
      ]
    },
    {
      "name": "pre_merge",
      "checks": [
        {
          "id": "check-fast-integration",
          "name": "Integration tests",
          "kind": "integration",
          "required": true,
          "timeout_minutes": 20,
          "pass_condition": "integration test suite passes"
        },
        {
          "id": "check-fast-latency",
          "name": "Latency benchmark",
          "kind": "latency",
          "required": true,
          "timeout_minutes": 10,
          "baseline_ref": "baseline-fast-001",
          "pass_condition": "latency regression remains under 15 percent"
        }
      ]
    }
  ]
}
